{
  "slug": "the-role-of-pharmacists-in-ongoing-care",
  "category": "Education",
  "title": "The role of pharmacists in ongoing care",
  "dek": "What pharmacists actually do, what they can advise on, and how their role fits alongside your GP when you're managing health over time.",
  "meta": {
    "updated": "May 2026",
    "readMinutes": 6
  },
  "hero": {
    "url": "https://seo-v2.c2u-lp-staging.pages.dev/assets/hero-the-role-of-pharmacists-in-ongoing-care.jpg",
    "alt": "A small marble mortar and pestle on a wooden surface beside an open notebook and a labelled bottle."
  },
  "stats": [
    {
      "value": "4 yrs training",
      "label": "Plus intern year"
    },
    {
      "value": "No appointment",
      "label": "Walk-in clinical advice"
    },
    {
      "value": "Meds review",
      "label": "Structured check of everything you take"
    },
    {
      "value": "6 min",
      "label": "Read time"
    }
  ],
  "toc": [
    "What Australian pharmacists are clinically trained to do.",
    "When to ask a pharmacist and when to see your GP instead.",
    "What a medication review is and who benefits most from one."
  ],
  "intro": "Pharmacists tend to be one of the most accessible health professionals in Australia, and one of the most underused outside of picking up a prescription. They're trained for years specifically in medicines, they're available without an appointment, and they're often free to ask questions of. Understanding what they actually do, and where their remit sits alongside your GP, makes ongoing care easier to navigate.",
  "sections": [
    {
      "heading": "What pharmacists are trained in",
      "blocks": [
        {
          "type": "p",
          "text": "Australian pharmacists complete a four-year undergraduate degree or a postgraduate Master of Pharmacy, followed by an intern year of supervised practice before they can register. After that, they continue ongoing professional development throughout their career."
        },
        {
          "type": "p",
          "text": "The core training is around medicines: how they work, how they're metabolised, how they interact with each other, what conditions they're used for, what side effects to watch for, and how to advise patients on safe use. They also cover the regulatory framework: the PBS, scheduling, supply rules, and the surrounding legal structure."
        },
        {
          "type": "p",
          "text": "They aren't trained to diagnose conditions in the way a GP is. They aren't substitutes for medical input on new symptoms or undiagnosed problems. But within their professional remit, which is broader than many people assume, they're a highly capable resource."
        },
        {
          "type": "keyTakeaway",
          "label": "Key takeaway",
          "body": "Pharmacists are clinically trained specifically in medicines. For anything to do with how a medicine works, how it interacts with others, side effects, supply issues or minor ailments, they're often the most efficient first port of call, usually with no appointment needed."
        }
      ]
    },
    {
      "heading": "Their role in ongoing care",
      "blocks": [
        {
          "type": "p",
          "text": "For people managing long-term conditions, pharmacists play several distinct roles."
        },
        {
          "type": "p",
          "text": "<strong>Dispensing prescriptions.</strong> This is the most visible part of the role. But what looks like a straightforward transaction usually includes a clinical check for interactions with other medicines you take, dose appropriateness, supply rules, and any safety considerations. Many of the pharmacist's most useful interventions happen quietly at this step."
        },
        {
          "type": "p",
          "text": "<strong>Counselling at supply.</strong> When you pick up a new prescription, the pharmacist will often ask whether you've had it before and offer a brief overview of what to expect. This isn't a formality. It's a structured opportunity to make sure you've understood how to take the medicine, what to watch for, and when to come back if something seems off. Taking 60 seconds for this conversation often makes the rest of the medicine experience smoother."
        },
        {
          "type": "p",
          "text": "<strong>Answering questions later.</strong> Once you've started a medicine, things come up: a question about timing, a side effect that wasn't expected, a missed dose, a clash with travel plans. A short phone call or quick visit to the pharmacy usually answers these without needing a GP appointment."
        },
        {
          "type": "p",
          "text": "<strong>Supplying pharmacist-only medicines.</strong> Certain medicines (Schedule 3 / Pharmacist Only) are supplied directly by a pharmacist after a brief assessment, without a prescription. This includes some pain relief, hayfever and other categories."
        },
        {
          "type": "p",
          "text": "<strong>Managing minor ailments.</strong> Many short-term concerns that don't need a doctor, such as minor coughs and colds, headaches, hayfever, mild skin issues, sleep difficulties, can be discussed with a pharmacist, who'll either recommend a suitable product, refer to a GP if needed, or talk through self-care options."
        },
        {
          "type": "p",
          "text": "<strong>Reviewing the bigger picture.</strong> Especially for anyone on multiple medicines, a pharmacist can step back and look at the whole medication regimen, checking for redundancy, interactions, adherence challenges, and opportunities to simplify. This is more structured in a formal Home Medicines Review, but happens informally any time you bring questions about your overall medicine list to a pharmacist."
        }
      ]
    },
    {
      "heading": "Working alongside your GP",
      "blocks": [
        {
          "type": "p",
          "text": "The pharmacist and GP relationship is collaborative, not competitive. Each has their own expertise, and ongoing care works best when both are involved."
        },
        {
          "type": "p",
          "text": "A useful mental model:"
        },
        {
          "type": "ul",
          "items": [
            "Your GP handles diagnosis, treatment plans, prescriptions, follow-ups, and clinical decision-making about your condition",
            "Your pharmacist handles supply, medicine-specific advice, interactions, side effects, and many self-care decisions",
            "Both can be involved in medication reviews, in escalating concerns to each other, and in supporting overall medicine safety"
          ]
        },
        {
          "type": "p",
          "text": "When something is genuinely unclear, both will often consult each other. A pharmacist who notices a potential interaction or supply issue will typically call the GP. A GP who isn't sure about a medicine-specific question will sometimes call the pharmacist. The two roles aren't isolated."
        },
        {
          "type": "p",
          "text": "For ongoing care, the practical implication is: use the right professional for the right question. Most medicine questions are pharmacist territory. Most diagnosis and treatment questions are GP territory. The middle ground, and there's plenty of it, usually benefits from input from both."
        },
        {
          "type": "readNext",
          "label": "Read next",
          "links": [
            {
              "label": "How the PBS works for chronic conditions",
              "url": "https://chemist2u.com.au/how-the-pbs-works-for-chronic-conditions/"
            },
            {
              "label": "The difference between prescription and pharmacist-only medicines",
              "url": "https://chemist2u.com.au/prescription-vs-pharmacist-only/"
            }
          ]
        }
      ]
    },
    {
      "heading": "What pharmacists can and can't do",
      "blocks": [
        {
          "type": "p",
          "text": "A few clarifications worth having in mind."
        },
        {
          "type": "p",
          "text": "They can:"
        },
        {
          "type": "ul",
          "items": [
            "Supply prescription medicines that have been prescribed by an authorised prescriber",
            "Supply Schedule 2 and Schedule 3 medicines without a prescription, with appropriate assessment",
            "Provide structured medicine information and counselling",
            "Conduct medication reviews",
            "Administer many vaccinations (the scope has expanded significantly in recent years)",
            "Provide minor ailment advice and self-care guidance",
            "Refer to a GP or other health professional when appropriate"
          ]
        },
        {
          "type": "p",
          "text": "They generally cannot:"
        },
        {
          "type": "ul",
          "items": [
            "Prescribe medicines that require a prescription (with some exceptions emerging in specific state-based pilots and structured programs)",
            "Diagnose new or complex conditions",
            "Order most medical tests",
            "Provide formal medical certificates for many purposes",
            "Substitute for a GP appointment when a clinical assessment is needed"
          ]
        },
        {
          "type": "p",
          "text": "The boundaries vary slightly by state, and the role is evolving, particularly around prescribing for specific conditions in certain structured programs. The default position, though, is the one above."
        }
      ]
    },
    {
      "heading": "When a pharmacist might say no",
      "blocks": [
        {
          "type": "p",